,blue
13,"Mọi điều bạn cần biết về đại hội toàn quốc của Đảng Cộng sản Việt Nam
Mọi điều bạn cần biết về đại hội toàn quốc của Đảng Cộng sản Việt Nam
Đại hội toàn quốc của Đảng Cộng sản Việt Nam có thể coi là một trong những sự kiện quan trọng nhất của đời sống chính trị Việt Nam. Bài viết này sẽ trả lời một số câu hỏi căn bản nhất về sự kiện này.. 
Đại hội toàn quốc, gọi đầy đủ phải là đại hội đại biểu toàn quốc, là “cơ quan lãnh đạo cao nhất của Đảng Cộng sản Việt Nam”. Điều này được ghi rõ trong Điều lệ Đảng, văn bản có giá trị hiệu lực cao nhất về mặt tổ chức của Đảng Cộng sản.. 
Tại sao một đại hội lại là “cơ quan” được? Vốn ta thường chỉ biết đến các cơ quan thường trực, tồn tại liên tục, có địa chỉ cụ thể. Nhưng còn một loại cơ quan quản lý nữa trong một tổ chức, đó là các cơ quan tồn tại trong một thời gian ngắn, chịu trách nhiệm ra một số quyết định không thường xuyên. Đại hội là một loại cơ quan như vậy.. 
Dự kiến, Đại hội 13 sẽ kéo dài chín ngày, từ 25/1 đến 2/2, tại Hà Nội.. 
Các đại hội đảng xưa nay kéo dài từ bốn ngày đến chín ngày.. 
5 năm một lần?. 
Không hẳn. Trong lịch sử kéo dài đến nay đã gần tròn 91 năm của mình, Đảng Cộng sản Việt Nam mới chỉ tổ chức 12 đại hội, kỳ tháng 1-2/2021 là kỳ thứ 13, nghĩa là trung bình bảy năm một lần. . 
Kể từ Đại hội Toàn quốc lần thứ VI năm 1986 đến nay, đại hội mới diễn ra đều đặn 5 năm một lần. Các kỳ trước đó tổ chức rất thất thường vì nhiều lý do (1935, 1951, 1960, 1976, 1982).. 
Là cơ quan lãnh đạo cao nhất của Đảng Cộng sản Việt Nam theo Điều lệ Đảng, về mặt hình thức, đại hội toàn quốc là nơi đưa ra những quyết định quan trọng nhất của tổ chức này, bao gồm:. 
Không có bầu tổng bí thư? Đúng vậy, chức tổng bí thư không phải do đại hội toàn quốc bầu ra. Ta sẽ xem xét vấn đề này ở phần sau của bài.. 
Đại hội 13 sẽ có 1.590 đại biểu tham dự. Có thể chia nhóm số đại biểu này theo nhiều cách khác nhau.. 
Theo cách thức tham dự: 194 đại biểu đương nhiên, 1.381 đại biểu được bầu và 15 đại biểu được chỉ định.. 
Theo khối đảng bộ: các đoàn đại biểu đại diện cho đảng bộ các tỉnh, thành; khối các cơ quan trung ương; khối doanh nghiệp trung ương; quân đội; công an; v.v.. 
Theo cơ cấu: thành phần tham dự đại hội thường đảm bảo một cơ cấu nhân sự nhất định dựa trên các tiêu chí về thành phần xã hội (giai cấp, vùng miền, giới tính, sắc tộc, tôn giáo, ngành nghề, v.v.). Các nhóm cơ quan, ban ngành, tổ chức (chính quyền, đoàn thể, doanh nghiệp) cũng đều có đại diện đi dự.. 
Về việc này, cần tham khảo Quyết định 244-QĐ/TW về quy chế bầu cử trong đảng.. 
Nhân sự được đưa ra biểu quyết ở đại hội là một danh sách ứng cử viên cho chức ủy viên Ban Chấp hành Trung ương Đảng. Danh sách này do Ban Chấp hành Trung ương khóa trước giới thiệu. Ngoài ra, các đoàn đại biểu có thể đề cử người ngoài danh sách trên ngay tại đại hội. . 
Do cơ chế và văn hóa làm việc của Đảng Cộng sản là cơ chế tập thể, gần như không có khả năng có người tự ứng cử, mặc dù quy chế cho phép. Mọi ứng cử viên đều phải được tập thể một đoàn đại biểu nào đó nhất trí giới thiệu ra đại hội.. 
Đại hội 13 sẽ bầu ra khoảng gần 200 ủy viên Ban Chấp hành Trung ương, trong đó có một thiểu số rất nhỏ (khoảng 20) ủy viên dự khuyết. Đây là phương án được Ban Chấp hành Trung ương thống nhất trình ra đại hội. Con số cụ thể sẽ do đại hội quyết định.. 
Ban Chấp hành Trung ương cũng là một cơ quan không thường trực của Đảng Cộng sản, họp mỗi năm 3-4 lần. Mỗi lần họp như vậy gọi là “hội nghị trung ương đảng”, đưa ra những quyết định lớn cả về chính sách lẫn nhân sự của đảng giữa hai kỳ đại hội. Trên thực tế, đây là “đấu trường” chính, có quyền lực rộng lớn trong đảng.. 
Cũng trong thời gian diễn ra đại hội, các ủy viên trung ương mới được bầu sẽ nhóm họp (hội nghị lần thứ nhất) để bầu ra các ủy viên Bộ Chính trị, Ban Bí thư và Ủy ban Kiểm tra Trung ương. Danh sách ứng cử viên sẽ bao gồm những người được Ban Chấp hành Trung ương khóa trước giới thiệu và những người ứng cử hoặc được đề cử tại hội nghị.. 
Cũng tại hội nghị này, Ban Chấp hành Trung ương sẽ bầu ra tổng bí thư theo danh sách ứng cử, đề cử.. 
Ban Chấp hành Trung ương khóa cũ cũng có thể giới thiệu người và đề xuất tiêu chuẩn lựa chọn vị trí này. Điều lệ Đảng nói rõ “Ban Chấp hành Trung ương bầu Bộ Chính trị; bầu Tổng Bí thư trong số ủy viên Bộ Chính trị…”.. 
Sau đại hội, Bộ Chính trị sẽ họp và phân công công tác các ủy viên Bộ Chính trị. Ai làm ủy viên thường trực, ai làm bí thư thành ủy Hà Nội và TP. Hồ Chí Minh, ai làm trưởng các ban đảng… sẽ được quyết định sau đại hội.. 
Khả năng cao là không. Có mấy lý do.. 
Lý do chính của việc này là quá trình bầu đại biểu đi dự đại hội sẽ do Ban Chấp hành Trung ương khóa cũ quyết định, từ quy chế cho đến khâu triển khai. Tiêu chuẩn nhân sự Ban Chấp hành Trung ương, Bộ Chính trị và tổng bí thư khóa mới hầu như đã được các cơ quan đảng khóa cũ quyết định. Hội nghị 14 của Ban Chấp hành Trung ương vừa kết thúc ngày 18/12/2020, tức là chỉ hơn một tháng trước đại hội, đã gần như hoàn chỉnh phương án nhân sự để trình đại hội. Sẽ còn một hội nghị nữa diễn ra trước đại hội để ra quyết định sau cùng.. 
Lấy ví dụ: Đại hội X năm 2006 cần bầu ra 160 ghế ủy viên chính thức của Ban Chấp hành Trung ương. Trong danh sách 207 ứng cử viên được thông qua, số lượng do Ban Chấp hành khóa trước đề cử lên đã là 174 người (84%). Chỉ 31 người được các đoàn đại biểu đề cử tại đại hội, và vỏn vẹn hai người tự ứng cử.. 
Do đó, mức độ can thiệp của Ban Chấp hành Trung ương và Bộ Chính trị khóa cũ vào nghị trình của đại hội là rất cao, đến mức có thể xem như đại hội là nơi hợp thức hóa các quyết định và thỏa thuận dàn xếp quyền lực của nhân sự khóa cũ. Khả năng đại hội ra quyết định ngược lại hoặc khác đi so với phương án Ban Chấp hành Trung ương trình là rất thấp.. 
Ngoài ra, lấy lý do là nguyên tắc tập trung dân chủ, đại hội bầu xong Ban Chấp hành Trung ương thì gần như là họ… hết nhiệm vụ chính trị của mình. Tất cả các quyết định chính trị quan trọng của Đảng Cộng sản Việt Nam, từ nhân sự cho đến định hướng phát triển kinh tế, chính trị, quốc phòng… đều được xây dựng bên trong “thâm cung”, vốn hoàn toàn nằm ngoài tầm với của các đoàn địa phương.. 
Đại hội toàn quốc của Đảng Cộng sản bao giờ cũng diễn ra vài tháng trước tổng tuyển cử, lần này là bốn tháng. Thông thường, kết quả bầu nhân sự ở đại hội đảng, cụ thể là các ủy viên Ban Chấp hành Trung ương, sẽ quyết định kết quả bầu cử Quốc hội và kết quả bầu các vị trí chủ chốt của chính quyền.. 
Khi đại hội đảng kết thúc, các vị trí chủ tịch nước, thủ tướng và chủ tịch Quốc hội coi như đã an bài. Cuộc tổng tuyển cử, đến lượt mình, đóng vai trò hợp thức hóa quyết định của Đảng Cộng sản.. 
"
14,"Kiểm soát xã hội bằng quyền lực y tế: Một ý tưởng không thể xem thường
Kiểm soát xã hội bằng quyền lực y tế: Một ý tưởng không thể xem thường
“Con người số y học” là một khái niệm lạ tại Việt Nam vừa được Bộ trưởng Bộ Thông tin và Truyền thông Nguyễn Mạnh Hùng nhắc tới trong Hội nghị Chuyển đổi số Y tế quốc gia ngày 30 tháng 12.. 
Hiểu đơn giản, theo cách vị bộ trưởng phát biểu, nếu dữ liệu khám bệnh của mọi người được lưu trữ, được phân tích (mà người viết cho rằng ông đang nói theo hướng thống nhất và tập trung hóa) sẽ hỗ trợ rất nhiều cho bác sĩ mỗi lần thăm khám, trong khi trí tuệ nhân tạo (AI) có thể tư vấn về cách sinh hoạt và giữ gìn sức khỏe.. 
“Chuyển đổi số y tế giúp hình thành một con người số y học của mỗi chúng ta. Trên những con người số y học này, việc khám chữa bệnh, dự báo trước, quản lý y tế quốc gia, chăm sóc y tế cá nhân hoá… sẽ có sự thay đổi căn bản. Những giá trị mới mà nó mang lại sẽ vô cùng to lớn cho người dân” – ông nhận xét. . 
Một viễn cảnh tươi đẹp hiện ra ngay trước mắt. . 
Thông tin sức khỏe toàn dân được lưu trữ để làm giàu cho hệ thống trí thông minh nhân tạo, tăng cường khả năng thực hiện tự động các tác vụ khuyến cáo sức khỏe và đề xuất thói quen ăn uống, sinh hoạt.. 
Hàng trăm ngàn bác sĩ trên toàn quốc có thể tra cứu thông tin và tiền sử bệnh của bệnh nhân, từ đó, họ có thể chẩn đoán và cho lời khuyên chuẩn xác, kịp thời.. 
Mặt khác, đây cũng là lúc chúng ta cần bàn về tương lai của quyền lực nhà nước và quyền lực mới của y học trong cách mà xã hội vận hành.. 
Quan trọng hơn, chúng ta, những người nắm bắt vận mệnh của tương lai sẽ phải quyết định như thế nào về chúng? . 
***. 
Triết gia người Pháp Michel Foucault là một trong những triết gia hậu hiện đại hiếm hoi bàn rất chi tiết, cũng như có cái nhìn rất đặc biệt về y tế trong tương lai của quyền lực.. 
Quyền lực trong lăng kính truyền thống là thứ quyền lực áp đặt của một giai tầng thống trị lên một giai tầng bị trị. Đó là thứ quyền lực của trừng phạt, của giết chóc, của chủ quyền tuyệt đối trên một lãnh thổ. . 
Chúng áp đặt từ trên xuống, dùng ngoại lực tác động vào. . 
Chúng là thứ quyền lực dùng vũ lực để bắt người ta phải phục tùng. . 
Trong bối cảnh đó, “quyền lực y tế” (medical power), suốt một thời gian dài, chưa từng được xem là tồn tại trong lịch sử loài người. . 
Trước đây, do hiểu biết hạn chế của con người về y – sinh học, chuyện sống chết, bệnh tật của con người là chuyện của… trời. . 
Tính chính danh của nhà nước không lệ thuộc, và nhà nước cũng không có nghĩa vụ can thiệp, vào sức khỏe của từng cá nhân trong xã hội. . 
Theo Foucault trong “The Birth of Clinic”, mọi thứ thay đổi vào thế kỷ 18 và 19 khi y tế trở thành một lĩnh vực mang lại lợi nhuận cao, trực tiếp dẫn đến quá trình mở rộng tri thức của loài người liên quan đến sức khỏe. Từ đó, ngành y tế được củng cố như là một ngành mũi nhọn và tối quan trọng cho sự tồn tại của xã hội loài người.. 
Từ một thứ chưa bao giờ nằm trong ngôn ngữ và diễn ngôn chính trị, sự trỗi dậy của y tế và thuốc men trong nền kinh tế đương đại đi cùng với mặt chính trị của nó – diễn ngôn về bảo vệ sức khỏe của toàn dân (defend  the  population’s  health). Bảo vệ sức khỏe của công dân, tăng cường tuổi thọ trung bình, khám và chữa bệnh cùng các dịch vụ kèm theo dần phổ biến trong các thảo luận chính trị, thậm chí trở thành tiêu chuẩn tiên quyết trong việc lý giải tính chính danh của một chính quyền.. 
Đi kèm theo nó là thứ quyền lực vô tiền khoáng hậu, thứ quyền lực không đến từ ngoại lực mà đến từ nội tâm của chính con người. . 
Họ mong muốn được “khỏe mạnh”, mong muốn được “bình thường”, mong muốn được sống đến đủ tuổi thọ “tiêu chuẩn”… . 
Kèm với đó là các câu hỏi: Ăn như thế nào? Uống như thế nào? Đi bộ như thế nào mới đúng cách? Thức dậy mấy giờ mới không mắc bệnh? Tắm mấy giờ và nước nóng lạnh như thế nào mới không bị đột quỵ? Bao nhiêu calories dinh dưỡng mỗi ngày là không thừa không thiếu? Và hàng chục vạn câu hỏi khác.. 
Tất cả được tiêu chuẩn hóa bằng quyền lực y tế, khoét sâu vào tâm trí con người. Sự vật hiện tượng được nhìn thông qua cái nhìn y tế (medical gaze), từ đó, không chỉ xác lập lại cách chúng ta hiểu về tình trạng và điều kiện sức khỏe của con người, mà còn xác lập lại nhân sinh quan của loài người (human subjectivity).. 
Foucault và các tác giả chịu ảnh hưởng của ông, như Peter Conrad, phân chia ra bốn nhóm biện pháp kiểm soát xã hội thông qua y tế: (1) tư tưởng y tế – medical ideology, (2) hợp tác y tế – collaboration, (3) công nghệ y tế – medical technology, và (4) giám sát y tế – medical surveillance. . 
Foucault không cho rằng y tế hiện đại có bản chất xấu. Ông khẳng định rất rõ sự trỗi dậy của nền y tế mới chủ yếu nhằm phủ nhận hàng thế kỷ u mê y tế với sự thống trị của tư duy mê tín trong chữa bệnh (medical superstition). . 
Tuy nhiên, đi kèm theo đó là sự phi nhân tính hóa một con người (dehumanisation). Chúng ta loại bỏ các yếu tố tâm lý hình thành một con người dựa trên tính cách, ý thức chính trị, quan điểm và tư duy của họ. Các thông tin quan trọng được lưu giữ, được ghi nhớ, được sử dụng để quản lý và để kiểm soát xã hội loài người là những thông tin sinh học, thói quen ăn uống, thể thao, tiền sử bệnh tật… . 
Quá trình y tế hóa (medicalisation), bắt đầu từ thế kỷ 18, dồn ép hành vi con người, cơ thể con người và từ đó là tư duy con người vào một mạng lưới y tế dày đặc, quan trọng nhưng cũng không kém phần nguy hiểm. Một mô hình mà gần như không cá thể nào có thể thoát ra hay tồn tại mà thiếu vắng nó. . 
Quan trọng hơn, Foucault cho rằng xã hội học sẽ rất sai lầm nếu coi lý thuyết về hệ thống thuốc men – y tế như những đối tượng nghiên cứu khách quan – trung lập, từ đó, khinh thường khả năng ngành y tế tự đầu tư vào bản thân để ngày càng tăng cường thẩm quyền và tính chính danh của chính nó.. 
Quá trình tập trung hóa quyền lực y tế, theo quan sát của người viết, dường như đã trở thành một động lực lịch sử khó có thể ngăn cản. Tất cả các chính phủ đều được yêu cầu can thiệp mạnh, can thiệp sâu và từ đó tập trung hóa thông tin, thủ tục, chi phí và điều trị y tế.. 
Quá trình can thiệp và điều chỉnh y tế (medical modification) không chỉ điều chỉnh hành vi con người, mà còn thay đổi tư duy và biến chuyển ưu tiên chính trị của các cộng đồng. Trong môi trường chính trị mà quyền lực y tế thống trị, những khái niệm và niềm tin liên quan đến tự do cá nhân, chính phủ hạn chế… trở nên khó truyền đạt lẫn khó nghe. . 
***. 
Đây không phải lần đầu tiên chính phủ một quốc gia toàn trị chuyển sự chú ý của quốc dân cũng như toàn thế giới sang y tế. Cuba, được đánh giá là quốc gia có tốc độ phát triển kinh tế và đô thị hóa kém, luôn đi đầu trong việc duy trì tuổi thọ trung bình cao và một nền y tế quốc dân hiệu quả. Họ làm được điều này nhờ can thiệp sâu, can thiệp sớm vào đời sống y tế của công dân, từ đó, áp đặt chế độ dinh dưỡng, khám chữa bệnh, sử dụng chiến thuật phòng bệnh hơn là phát triển công nghệ để chữa trị nó.. 
Chính sách này được thực hiện rất hiệu quả, nhưng đổi lại là thẩm quyền y tế và thẩm quyền nhà nước trở thành một. Không chỉ giới hạn là một loại quyền lực từ trên xuống, chúng len lỏi sâu vào tư duy và đời sống của các cộng đồng, khiến người dân lệ thuộc vào sự vận hành của một hệ thống y tế nhất định, đặc biệt khi nó vận hành tốt. Trật tự xã hội cũng từ đó mà trở nên khó lay chuyển hơn, khóa chặt các thế hệ tương lai vào một hệ thống chính trị bất di bất dịch. . 
Việt Nam còn lâu mới được xem là một cường quốc y tế, và cũng còn rất xa để được xem là một quốc gia có nền y tế hiệu quả. Nhưng, tầm nhìn của Bộ trưởng Nguyễn Mạnh Hùng rõ ràng là không thể xem thường. Định hướng xây dựng “con người số y học” là một bước tiến gần hơn đến quyền lực y tế của Đảng Cộng sản Việt Nam, với khả năng thay đổi hoàn toàn những thảo luận về tương lai dân chủ và sự phát triển mới, tầm nhìn mới cho hệ thống chính trị Việt Nam.. 
"
