,blue
24,"Sách “Án lệ vựng tập”: Có một nền pháp luật Việt Nam Cộng hoà như thế
Sách “Án lệ vựng tập”: Có một nền pháp luật Việt Nam Cộng hoà như thế
“Ngụy quyền”, “tay sai giặc Mỹ”, “chính quyền bù nhìn của đế quốc Mỹ”.. 
Đây là những phản hồi tôi thường nhận được khi hỏi một vài bạn trẻ (ít nhất là trẻ hơn tôi) về Việt Nam Cộng hoà. Pháp luật Việt Nam Cộng hòa, theo đó, có thể được xem là một thứ pháp luật đàn áp, tàn độc, là thứ pháp luật “lê máy chém đi khắp miền Nam”.. 
Câu hỏi đặt ra là, với một hệ thống pháp luật đơn giản một chiều như vậy, làm sao quốc gia này có thể tồn tại tròn 20 năm và đạt được nhiều thành tựu thời chiến đáng ghi nhận cả về kinh tế, khoa học – công nghệ và đặc biệt là giáo dục khi so sánh với mặt bằng chung của quốc tế? Các mối quan hệ dân sự tại VNCH phát triển và được bảo vệ đến mức nào, hay chỉ tương tự như miền Bắc Việt Nam?. 
Đây là những câu hỏi rất khó để trả lời, vì lịch sử nhà nước và pháp luật của VNCH vẫn còn là đề tài nhạy cảm, thậm chí cấm kỵ trong bất cứ cuộc trò chuyện nào của người dân Việt Nam, dù là thảo luận khoa học hay chỉ là tán gẫu.. 
Vậy nên, “Án lệ vựng tập”, một quyển sách công phu dày đến hơn 750 trang của thẩm phán, Chánh án Trần Đại Khâm, quả là một tài liệu quý giá.. 
Song, với một công trình đồ sộ như thế, không phải bạn đọc nào cũng có thời gian dò xét toàn bộ quyển sách. Dưới đây, tác giả điểm lại một số đặc điểm thú vị của hệ thống pháp luật và án lệ VNCH cả về dân sự, điền địa, lao động, lẫn nhà phố, thương mại, hình sự, quân sự và hành chính, hy vọng có thể kích thích trí tò mò của độc giả.. 
Tính kế thừa của pháp luật Việt Nam Cộng Hòa. 
Chính quyền Việt Nam Cộng Hòa trước nay được xem là kế thừa tính chính danh của chính quyền vua Bảo Đại, vậy nên các luật gia VNCH có xu hướng chấp thuận di sản pháp luật mà người Pháp để lại.. 
Điểm đáng chú ý về vấn đề này là quyển sách ghi nhận thời điểm Việt Nam thu hồi chủ quyền tư pháp là vào năm 1949. Dấu mốc này có thể ám chỉ đến Hiệp ước Elysée (Elysée Accords), văn bản thỏa hiệp giữa cựu hoàng Bảo Đại và chính phủ Pháp, chính thức trao lại nhiều chủ quyền tài chính, quân sự và quản lý nhà nước quan trọng cho Việt Nam.. 
Trong tổng hợp các án lệ, tòa án VNCH cũng như nhiều học giả vẫn dẫn chiếu và sử dụng Nghị định ngày 16/3/1910 (do Toàn quyền Đông Dương ban hành) để định hướng xử lý trình tự và thủ tục tố tụng của toà án. Nghị định này cũng được nhắc đến trong Sắc lệnh 03 của Hồ Chí Minh, Chủ tịch Lâm thời Việt Nam Dân chủ Cộng hòa, liên quan đến luật áp dụng kể từ năm 1946. Văn bản pháp quy về mặt nội dung được ban hành trước năm 1945 như Sắc lệnh Điền thổ hay Hoàng Việt Hộ luật năm cũng đều được công nhận hiệu lực và áp dụng trong một số trường hợp.. 
Việt Nam Cộng hòa theo truyền thống pháp luật Dân luật (Châu Âu lục địa) hay Thông luật (Anglo-Saxon)?. 
Có nhiều tiêu chí để phân biệt các truyền thống pháp luật Châu Âu lục địa và Anglo Saxon. Một trong những tiêu chí dễ nhận thấy nhất là việc hệ thống Anglo Saxon công nhận các bản án của các cấp toà như là một phần của hệ thống pháp luật và gọi nó là án lệ. Trong khi đó, các tòa thuộc hệ thống pháp luật Châu Âu lục địa có thẩm quyền hạn chế hơn, chỉ ở mức giải thích và vận dụng văn bản pháp luật thay vì sáng tạo và đưa ra các nguyên tắc pháp luật mới.. 
Với tên gọi “Án lệ Vựng tập”, quyển sách có thể khiến cho độc giả nghĩ rằng pháp luật VNCH có xu hướng của Thông luật. Tuy nhiên, điều này không hoàn toàn chính xác. Văn bản pháp luật vẫn là nguồn chính yếu của pháp luật VNCH. Tuy nhiên, có vẻ như tòa án VNCH có một số quyền lực nhất định trong việc giải thích và quy định các trình tự thủ tục tố tụng thuộc thẩm quyền của mình. Điều này dẫn đến việc ta có thể xem xét sự giao thoa nhất định của hai truyền thống pháp luật trong hệ thống pháp luật VNCH.. 
Bảo vệ an toàn lao động ngay từ những năm 1950. 
Theo một bản án vào năm 1957, ông Ngô Văn Ba chết khi đang làm việc cho một xưởng sửa xe máy. Nguyên cớ là vì ông tự mình làm vỡ tủ kiếng, bị cắt nhiều chỗ trên cơ thể và mất nhiều máu; không phải do máy móc hay công việc của xưởng giao cho. Dẫu vậy, theo pháp luật VNCH, ngay cả khi ông chết không phải do tác động trực tiếp từ máy móc, công cụ hay lỗi của chủ lao động, thì chủ lao động vẫn có trách nhiệm bồi thường cho ông.. 
Thêm vào đó, việc chi tiền, thỏa hiệp với người thân để bãi nại (không theo đuổi vụ kiện, không khởi kiện bên gây thiệt hại) là không có hiệu lực trong những vụ gây tổn hại sức khỏe, tính mạng. Quyền kiện đòi bồi thường trong những vụ việc này là tuyệt đối.. 
Quyền sở hữu bất động sản khá phát triển và hiện đại. 
Quyền sở hữu đất đai (không phải quyền sử dụng như hiện nay) của công dân được bảo hộ tuyệt đối bằng quá trình “đăng bộ”. Trong đó “bằng khoán” là minh chứng cho việc công nhận quyền sở hữu của mình.. 
Vật quyền trên bất động sản cũng cần phải được đăng tịch mới có thể làm bằng cớ để phản bác cáo buộc của bên thứ ba (đệ tam nhân).. 
Trách nhiệm, lỗi và yêu cầu bồi hoàn từ hành vi của công chức. 
Lỗi của công chức nhà nước được chia làm hai loại trong pháp luật VNCH, gồm lỗi chức nghiệp (faute de service) và lỗi cá nhân (faute personnelle). Nếu người khởi kiện cho rằng đó là lỗi chức nghiệp của công chức, tức là công chức tuân thủ đúng quy trình nhưng vẫn gây thiệt hại, thì cơ quan của công chức ấy sẽ bị kiện trước tòa án hành chính. Nếu công chức phạm lỗi cá nhân thì sẽ bị khởi kiện trước tòa án dân sự.. 
Tuy nhiên, để đảm bảo rằng công dân bị thiệt hại có nhiều quyền nhất có thể khi kiện đòi bồi thường, lỗi cá nhân sẽ không loại trừ lỗi chức nghiệp. Nạn nhân vì vậy có thể đòi bồi thường vừa từ phía cơ quan nhà nước, vừa từ phía công chức.. 
Các chế định pháp lý dân sự phát triển ở trình độ phát triển cao và khá chi tiết. 
Đối với các hợp đồng (khế ước) nhằm che giấu một mật ước đằng sau thì chỉ có mật ước có hiệu lực pháp lý. Song do bản chất thực sự của khế ước bị che giấu, mật ước sẽ không thể tác động đến quyền và lợi ích của bên thứ ba.. 
Hay đối với nghĩa vụ liên đới, các án lệ thời kỳ đầu của VNCH cũng cho thấy lý luận pháp lý của các tòa tại Việt Nam không thua kém các tòa dân sự trên thế giới.. 
Nghĩa vụ liên đới đối với vật vô tri thì chỉ được xác lập trong trường hợp luật định hay có cam kết liên đới. Một số án lệ phân biệt rạch ròi giữa nghĩa vụ liên đới đối với đồ vật vô tri và các loại tài sản khác như nhà ở. Trong trường hợp người bán đồ vật vô tri (như xe hơi, xe máy) đã bán và hoàn thành việc chuyển giao đồ vật thì họ không phải chịu trách nhiệm gì về tai nạn mà chiếc xe đó gây ra. Ngược lại, nếu chủ sở hữu chỉ giao quyền chiếm hữu, sử dụng tạm thời cho một cá nhân khác thì họ luôn phải chịu trách nhiệm liên đới đối với tai nạn tương tự.. 
Đối với nghĩa vụ liên đới trong tiền thuê nhà, cần xác định ranh giới giữa người thuê chính của căn nhà và những cá nhân thuê lại căn phòng trong căn nhà một cách riêng biệt. Người thuê lại căn phòng chỉ chịu trách nhiệm về tiền thuê nhà và những thiệt hại trong phạm vi căn phòng họ thuê lại.. 
Các chế định bảo vệ quyền sở hữu trí tuệ được tiếp nối và phát triển ngay từ năm 1941?. 
Hai văn bản pháp lý thường được sử dụng trong các tòa án VNCH để bảo vệ quyền sở hữu trí tuệ thuộc khu vực này là Dụ số 9 ngày 24/2/1941 quy định về quyền sở hữu văn chương, mỹ thuật và kỹ nghệ.. 
Việc ký nạp tác phẩm (có thể hiểu là đăng ký thông tin tác phẩm) được thực hiện tại Bộ Quốc gia Giáo dục. Tuy nhiên, việc ký nạp tác phẩm chỉ làm cơ sở xem xét hành vi xâm phạm quyền “trước tác” là có thể tố cáo tại Tòa Hình sự. Nếu tác phẩm chưa được ký nạp, tác giả hoặc người kế quyền vẫn có thể thưa kiện trước Tòa Dân sự.. 
Các khái niệm quyền sở hữu trí tuệ hiện đại như nhãn hiệu, sáng chế cũng được chính quyền VNCH học hỏi và áp dụng từ rất sớm.. 
Khác với pháp luật Việt Nam hiện nay, các án lệ VNCH liên quan đến quyền sở hữu trí tuệ khẳng định rằng việc ký nạp nhãn hiệu chỉ có hiệu quả tuyên nhận, mà không có hiệu quả kiến tạo. Điều này có nghĩa là hành vi đăng ký chỉ là bắt đầu sự thừa nhận của chính quyền đối với quyền sở hữu nhãn hiệu. Như vậy, việc một nhãn hiệu đang tồn tại, chưa được ký nạp, không có nghĩa là bất kỳ ai cũng có thể đăng ký nó thuộc quyền sở hữu của mình.. 
Bạn đọc có thể tải cuốn “Án lệ Vựng tập” tại đây hoặc tại đây, và ghé thăm fanpage Luật Khoa thư quán và Thú Chơi Sách để tiếp cận với nhiều đầu sách quý khác.. 
"
25,"Về Cảnh sát Quốc gia và Công an Nhân dân
Về Cảnh sát Quốc gia và Công an Nhân dân
Tổng quan lịch sử về lực lượng Cảnh sát Quốc gia của Việt Nam Cộng hoà và Công an Nhân dân của Cộng hoà Xã hội Chủ nghĩa Việt Nam.. 
Cảnh sát Quốc gia của Việt Nam Cộng hoà. 
Khái niệm cảnh sát xuất hiện sớm ở Việt Nam, từ khi ta còn là thuộc địa của Pháp. Đến năm 1954, thực hiện một số quy định của Hiệp định Geneva, miền Nam Việt Nam mới chính thức có lực lượng Cảnh sát Quốc gia (CSQG) độc lập, do người Việt trực tiếp điều hành và quản lý.. 
Trong một khoản thời gian ngắn ban đầu, mô hình của CSQG khá tương tự với mô hình cảnh sát Pháp – French Metropolitan Police, có trách nhiệm gìn giữ trị an và đối phó với tội phạm. Lực lượng này nằm dưới sự chỉ đạo của Bộ Nội vụ, với các Giám đốc Nha cảnh sát địa phương chịu trách nhiệm trực tiếp với bộ trưởng.. 
CSQG bao gồm cảnh sát được đào tạo bài bản bổ sung cho lực lượng chung, kết hợp với các đội Hiến binh (Gendarmerie), có trách nhiệm chuyên trách bảo vệ các thành phố lớn và thủ phủ địa phương. Đội Hiến binh cũng học từ mô hình của Pháp mà ra. Mô hình được áp dụng rộng rãi ở nhiều quốc gia sau các cuộc chinh phạt Napoleonic, và kéo dài đến tận ngày nay. Đội Hiến binh có tính quân sự cao và được trang bị đầy đủ hơn cảnh sát thông thường.. 
Các cảnh sát chuyên trách hình án tương tự như French Compagnies Républicaines de Sécurité (CRS) cũng được chú trọng xây dựng, song đặc biệt nhất phải kể đến lực lượng dân quân không chuyên, có thể được triệu tập để kiểm soát bạo động và duy trì trật tự trị an nếu bất ổn xã hội xảy ra trên diện rộng. Với đỉnh điểm nhân lực có khi đến hơn 15.000 người, đây cũng là nguồn cung quân nhân có qua đào tạo cơ bản cho quân đội.. 
Mô hình này kéo dài được khoảng một năm thì có những thay đổi cơ bản. Năm 1955, ông Ngô Đình Diệm từ chối thực hiện một phần quan trọng trong Hiệp định Geneva là thực hiện tổng tuyển cử cả hai miền Nam Bắc và đánh bại Hoàng đế Bảo Đại trong một cuộc trưng cầu dân ý bất ngờ ở miền Nam Việt Nam. Tháng 10 năm 1955, Việt Nam Cộng hòa chính thức được thành lập và lực lượng CSQG bắt đầu mang dấu ấn của Ngô Đình Diệm nhiều hơn.. 
Một trong những dấu ấn cụ thể nhất, là việc ông Diệm trao quyền kiểm soát CSQG cho em trai mình – ông Ngô Đình Nhu. Về mặt lập pháp và kiểm soát quyền lực, đây là một quyết định đáng bị lên án. Tuy nhiên, xét trong tình hình chính trị phức tạp, chủ nghĩa lãnh chúa quân sự cát cứ ngay bên trong miền Nam Việt Nam và các yếu tố chiến tranh với Bắc Việt, quyết định này là có thể hiểu được.. 
Dẫu vậy, xét mặt chủ quan, bản chất của CSQG vẫn bị thay đổi khá nhiều.. 
Đầu tiên, một đội cảnh sát mật vụ được bổ sung để theo dõi các nhóm bất đồng chính kiến. Nhiều nhóm nhận nhiệm vụ thâm nhập các tổ chức công đoàn và tổ chức xã hội dân sự, xây dựng mạng lưới thông tin tình báo và báo cáo lên trên về bất kỳ ai có thể trở thành kẻ thù của hai anh em nhà họ Ngô. Không chỉ vậy, nhiều nhà quan sát còn đặt vấn đề về tính độc lập và thân hữu của chính phủ ông Diệm khi bà Trần Lệ Xuân, vợ ông Nhu, cũng có tiếng nói trong việc kiểm soát CSQG.. 
Vào tháng 11 năm 1963, với cuộc đảo chánh lật đổ và giết hại cả Ngô Đình Diệm và Ngô Đình Nhu, lực lượng CSQG được độc lập ở một mức độ nhất định. Tuy nhiên, họ cũng bị buộc phải đóng một vai trò quân sự quan trọng hơn khi các nhóm nổi loạn vũ trang Marxist, Phật giáo… tại miền Nam bắt đầu trỗi dậy. Năm 1965, đỉnh điểm quân số của CSQG là tầm 41.000 sĩ quan (khoảng 0,2% dân số miền Nam Việt Nam).. 
Tuy nhiên, hầu hết các hoạt động dân chủ, hội họp của người dân miền Nam vẫn có thể diễn ra bình thường dưới sự giám sát của lực lượng này. Trong đó, rất nhiều phong trào bùng nổ trên quy mô lớn như phong trào sinh viên học sinh hay phong trào văn nghệ phản chiến. Mặt khác, các hoạt động đa nguyên, đa đảng phái vẫn diễn ra khá bình thường.. 
Trong trận Tết Mậu Thân 1968, khi mà lực lượng quân đội chính quy quân lực Việt Nam Cộng hòa và các cố vấn quân sự Hoa Kỳ chủ yếu đóng tại các khu vực ngoại ô và nông thôn, lực lượng CSQG là nòng cốt chính để chặn đứng các mũi tiến công và nổi dậy của quân nhân phe cộng sản miền Bắc vốn có khả năng chiến đấu vượt trội. Tuy nhiên, những nỗ lực và thành quả của CSQG gần như bị lãng quên trên trường quốc tế sau khi Tổng Giám đốc Tổng nha Cảnh sát Quốc gia lúc đó – ông Nguyễn Ngọc Loan (thường gọi là tướng Loan, dù ông này không có hàm tướng), xử tử một thành viên của phe cộng sản ngay trước ống kính truyền hình – báo chí Hoa Kỳ.. 
(Nguồn tại Encyclopedia of the Vietnam War: A Political, Social, and Military History với các từ khóa Public Security, National Police, Ngo Dinh Nhu, Ngo Dinh Diem). 
Công an Nhân dân của Cộng hòa Xã hội Chủ nghĩa Việt Nam. 
Đối với miền Bắc, ngày 21-2-1946, Chủ tịch Hồ Chí Minh ký Sắc lệnh số 23/SL thống nhất lực lượng Cảnh sát (thuộc Pháp) và Liêm phóng toàn quốc thành Việt Nam Công an vụ thuộc Bộ Nội vụ. Mô hình này có vẻ khá tương tự với Nha Cảnh sát trong miền Nam.. 
Tuy nhiên, với giai đoạn 1948 – 1953, tổ chức bộ máy của Công an Nhân dân ở miền Bắc có ba lần điều chỉnh, Nha Công an được đổi tên gọi thành Thứ Bộ Công an, sau là Bộ Công an. Như vậy, khác với mô hình VNCH, chính phủ Bắc Việt chính thức hình thành một Bộ độc lập quản lý vấn đề an ninh công cộng.. 
Ngoài đặc điểm gắn liền với các hoạt động quân sự của lực lượng quân đội Bắc Việt, lực lượng Công an cũng có vai trò chủ động tích cực trong việc gìn giữ trật tự trị an và diệt địa chủ, mà họ tự gọi là “phá tề, trừ gian, diệt ác”. Ở miền Nam, tiền thân của lực lượng Công an Nhân dân gồm có Ban Bảo vệ An ninh Xứ ủy (sau là Ban An ninh Trung ương Cục) và Ban An ninh các cấp.. 
Sau 1975, Bộ Công an ngày càng lớn mạnh và trở thành một trong những siêu bộ đáng gờm nhất của bộ máy chính trị Việt Nam. Bộ là một cách tay đắc lực để hoàn thành chỉ tiêu “đánh tư sản miền Nam” ngay sau 1975 cho đến tận những năm 1990.. 
Hiện nay, người dân Việt Nam có thể thấy bóng dáng của công an trong gần như mọi quan hệ xã hội. Từ vấn đề quản lý nhân khẩu – hộ khẩu, thường trú – tạm trú, xe máy – xe ô tô, văn hóa – văn nghệ, hội họp, dân sinh .v.v. Có thể nói, xã hội Việt Nam đã hình thành văn hóa công an từ lúc nào không hay biết.. 
Hầu hết những cấp quyền lực công an đều có khả năng gây ảnh hưởng lớn đến các hoạt động dân sự của người dân.. 
Công an xã, là lực lượng không chính quy trong bộ máy này, nhưng cũng là lực lượng xông xáo nhất trong việc can thiệp vào đời sống và sinh hoạt xã hội của người dân. Từ việc thường xuyên gửi thư mời làm việc không căn cứ cho bất kỳ cá nhân tổ chức nào bình luận không vừa mắt cho đến dùng cơ chế tạm trú – tạm vắng để quấy rối nhiều nhà hoạt động dân sự.. 
Trong khi đó, các cơ quan trung ương như Cục An ninh Chính trị Nội bộ, Cục An ninh Văn hóa – Tư tưởng, Cục An ninh mạng,… cũng đang dần mở rộng chân rết của mình ra các lĩnh vực khác. Với sự ra đời và chuẩn bị có hiệu lực của Luật An ninh mạng, với vai trò được chỉ mặt đặt tên ghi trong luật, Bộ Công an chính thức nắm quyền sinh sát một phần quan trọng của đời sống người dân Việt Nam hiện đại.. 
Mặt khác, quy mô của Bộ Công an Việt Nam hiện nay nếu so với thời kỳ đỉnh cao của VNCH trong thời chiến cũng như so sánh trời và vực. Chỉ tính số lượng tướng trong ngành, có đến 205 hàm cấp tướng, bằng ½ so với hàm cấp tướng bên Bộ Quốc Phòng, trong khi VNCH không cấp hàm tướng cho lãnh đạo thuộc Tổng nha Cảnh sát. VNCH chỉ coi cảnh sát là các nhân viên công vụ dân sự thông thường. Tình hình chỉ thay đổi sau khi chiến sự Việt Nam trở nên căng thẳng và Tổng thống Thiệu quyết định cải tổ ngành Cảnh sát Quốc gia, chuyển đổi nhân sự quân đội – cảnh sát qua lại với nhau. Mô hình cấp bậc của quân đội từ đó cũng được du nhập. Song số lượng tướng thuộc Tổng nha Cảnh sát (hay Bộ Tư lệnh Cảnh sát sau 1971) vẫn chỉ đếm trên đầu ngón tay.. 
Riêng về số lượng cán bộ – chiến sĩ, theo nhiều nghiên cứu hiện nay, đã có hơn 1,2 triệu người trong ngạch chính thức, và thậm chí thêm 5 triệu thành viên thuộc dạng dân phòng, dân quân tự vệ bán quân sự được trả lương. Để dễ hình dung, con số này chiếm đến 11,7% khối người đang trong độ tuổi lao động ở Việt Nam.. 
Từ khoá:. 
cảnh sát quốc gia: national police
công an nhân dân: the people’s public security
Bộ Công an: Ministry of Public Security
Việt Nam Cộng hoà: The Republic of Vietnam
Cộng hoà Xã hội Chủ nghĩa Việt Nam: The Socialist Republic of Vietnam. 
"
