,blue
0,"Lịch sử muôn mặt của “mặt trận”: Từ thế giới đến Việt Nam
Lịch sử muôn mặt của “mặt trận”: Từ thế giới đến Việt Nam
Những ngày vừa qua, Mặt trận Tổ quốc Việt Nam (MTTQ VN) đã giương cao ngọn cờ “đại diện” cho mọi thành phần, mọi tầng lớp nhân dân để… thanh lọc và lựa chọn danh sách các đại biểu Quốc hội cho kỳ bầu cử sắp tới.. 
Ít người dân Việt Nam hiểu vai trò và mục tiêu của Mặt trận Tổ quốc Việt Nam, thậm chí còn không biết đến sự tồn tại của tổ chức này. Thực tế cho thấy rằng mặt trận cũng ít có thực quyền trong cơ cấu chính trị và nhà nước hiện nay.. 
Tuy nhiên, với hàng loạt tổ chức chân rết thành viên cũng như một lực lượng lớn cán bộ được duy trì nhờ nguồn kinh phí nhà nước, MTTQ sẽ tiếp tục là một thế lực quan trọng với danh nghĩa tổ chức chính trị tự nguyện đại diện cho mọi tầng lớp nhân dân.. 
Nếu tìm hiểu về lịch sử của chính quyền Việt Nam hiện nay, bạn đọc sẽ nhận ra rằng MTTQ không phải là hình thức tồn tại duy nhất của khái niệm mặt trận tại Việt Nam. Trước đó, có thể kể đến những cái tên lừng danh (hay khét tiếng) khác như Mặt trận Phản đế, Mặt trận Dân tộc Thống nhất hay Mặt trận Dân tộc Giải phóng miền Nam Việt Nam.. 
Vậy khái niệm tổ chức chính trị “mặt trận” là từ đâu ra? Và lý do tồn tại của nó trong lịch sử cũng như hiện tại ở Việt Nam là gì?. 
Lịch sử của hình thái tổ chức chính trị mặt trận (front) trên thế giới gắn liền với các chính đảng cánh tả và trung lập, mà đặc biệt là các đảng cộng sản. Tuy vậy, ngày nay rất nhiều chính đảng cánh hữu hay cực hữu khác (như Mặt trận Quốc dân – National Front tại Pháp) đều sử dụng tên gọi này cho mục tiêu chính trị của mình.. 
Nhìn chung, mặt trận được sử dụng khi người thành lập muốn gầy dựng nên một tổ chức chính trị có thể tập hợp nhiều nhất các thành phần giai cấp, tôn giáo, định hướng chính trị và hệ tư tưởng, nhằm tạo nên một sức mạnh chính trị chống lại một kẻ thù chung nhất định.. 
Tương tự như đánh trận, việc các bên bỏ qua khác biệt không mang tính chất sống còn để dồn lực vào chỉ một chiến trường, một mặt trận sẽ giúp các nguồn lực chính trị được tập trung và sử dụng hiệu quả hơn.. 
Thêm vào đó, những tổ chức chính trị có khả năng chi phối nội bộ và tổ chức của mặt trận còn có cơ hội tăng cường tính chính danh, tìm kiếm thêm sự ủng hộ và cơ hội đưa ra các diễn ngôn dân túy… biến mình trở thành đại diện chung của các giai tầng và tổ chức chính trị quần chúng cơ sở nhân dân.. 
Tổ chức chính trị có danh nghĩa mặt trận đầu tiên, cũng như có vị trí đặc biệt quan trọng trong lịch sử chính trị thế giới là một tổ chức dưới quyền và chịu sự ảnh hưởng trực tiếp của Quốc tế Cộng sản: Communist International, hay gọi tắt là Commitern.. 
Về mặt lịch sử, sự tiến hóa của hình thức tổ chức này tương đối phức tạp. Trước thập niên 1930, Đảng Cộng sản Đức (KPD) và Đảng Quốc xã Đức (Nazis) có kẻ thù chung là chính quyền dân chủ đầu tiên được thử nghiệm tại Đức – Cộng hòa Weimar.. 
Tuy nhiên, khác biệt về tư tưởng cũng như nhu cầu cạnh tranh sự ủng hộ của quần chúng để giành độc quyền kiểm soát nền chính trị Đức khiến cho cả hai chính đảng này kèn cựa và luôn đấu tranh với nhau rất lâu, đôi khi dẫn đến xung đột vũ trang.. 
Sau các cuộc khủng hoảng thừa và khủng hoảng tài chính thế giới liên tục vào các năm 1929, 1931 và 1933, nền chính trị Đức nhanh chóng bị Hitler và chủ nghĩa phát-xít (fascism) thu hút, đẩy các tổ chức cơ sở cộng sản vào thế bị truy lùng và đàn áp. Chủ nghĩa phát-xít từ đó bắt đầu tìm được tiếng nói tại Tây Ban Nha, Ý lẫn Áo.. 
Đức vì vậy được xem là mặt trận chính thống chống phát-xít, căn cứ trên nghị quyết – đường lối được công bố tại Đại hội lần thứ Bảy của Quốc tế Cộng sản.. 
Mô hình Mặt trận Nhân dân Phản chiến và Chống phát-xít (People’s Front of struggle against fascism and war, cũng có thể gọi là United Front hay Popular Front, ở Việt Nam hay gọi là Mặt trận Bình dân) được phát động. Nó trở thành nhiệm vụ chung đối với hầu hết các chính đảng cộng sản đang hoạt động trên toàn thế giới.. 
Nói một cách dễ hiểu, các chính đảng cộng sản sẽ chấp thuận từ bỏ đường lối chính trị cơ bản là muốn xây dựng chính quyền chuyên chính vô sản. Thay vào đó, họ chấp nhận liên minh với các hội, nhóm, chính đảng chính trị khác, miễn là có thể đồng thuận chung về mục tiêu chống phát-xít.. 
Về mặt định hướng, Quốc tế Cộng sản tin rằng đây là cách để các đảng cộng sản trong nước chứng minh năng lực, tăng cường tiếp xúc với nhiều đối tượng xã hội khác và từ đó thu hút sự ủng hộ, đi kèm với việc tạo lợi thế số đông chống lại chủ nghĩa phát-xít.. 
Mô hình này khiến cho khái niệm cũng như triết lý của một tổ chức mặt trận trở nên phổ biến tại nhiều quốc gia đang trong tiến trình đấu tranh chống thực dân và giành độc lập.. 
Tuy nhiên, các tổ chức mặt trận cũng nhanh chóng hiện rõ vị thế là một tổ chức chính trị lệ thuộc vào định hướng và sự thao túng của Đảng Cộng sản Liên Xô nói chung và các đảng cộng sản địa phương nói riêng.. 
Vào năm 1939, Stalin quyết định liên minh với Hitler thông qua thỏa ước không xâm phạm lẫn nhau. Quyết định này giúp Stalin có thời gian xây dựng lại lực lượng quân sự rệu rã sau nhiều năm thanh trừng, từ đó chiếm cứ các vùng lãnh thổ, quốc gia khác (như Phần Lan) được cho là từng thuộc đế chế Nga tiền Cách mạng tháng Mười.. 
Kể từ đó, những mặt trận phản chiến và chống phát-xít trở mặt 180 độ.. 
Thay vì chống tư tưởng phát-xít và các tội ác diệt chủng lan rộng tại Đức, các mặt trận lại bắt đầu tuyên truyền cho hòa bình với chính quyền Đức. Họ lên án Anh – Mỹ vì cho rằng việc các nước này chuẩn bị cho chiến tranh chống Đức và giải phóng các vùng lãnh thổ bị Quốc xã chiếm đóng là hành vi tuyên truyền và làm leo thang “chiến tranh đế quốc”.. 
Nhiều tư liệu ghi nhận rằng các chính đảng cộng sản tại Anh hay Pháp đã hết sức bối rối về việc Liên Xô ký kết hòa ước với Đức. Họ phải nhiều lần yêu cầu có chỉ thị chung từ đích thân đồng chí Stalin về tương lai và định hướng của các tổ chức mặt trận.. 
Lịch sử cũng đã ghi nhận những tổ chức mặt trận “đổi gió” nhanh đến thế nào khi Đức chính thức tấn công Liên Xô. “Cuộc chiến đế quốc” bạo tàn vô nghĩa nhanh chóng trở thành cuộc thánh chiến vì dân chủ và tự do của nhân loại.. 
Mặt trận Tổ quốc Việt Nam (tên tiếng Anh: Vietnam Fatherland Front) là một tổ chức chính trị cơ bản cấu thành hệ thống chính trị Việt Nam. Nó là hình thức tồn tại hiện nay của mô hình Mặt trận Dân tộc Thống nhất tại Việt Nam.. 
Bên cạnh sự lãnh đạo không thể phủ nhận của Đảng Cộng sản Việt Nam, MTTQ được xem là là tổ chức đại diện chung cho khối đại đoàn kết dân tộc, vừa là thành viên, song cũng thay mặt cho tất cả các tổ chức chính trị – xã hội – nghề nghiệp khác (như Hội Phụ nữ, Hội Cựu chiến binh, Hội Người cao tuổi, Liên đoàn Lao động…) trong đời sống chính trị – xã hội Việt Nam.. 
Chính vì tính “đại diện chung” này (dù do chỉ định mà có), MTTQ luôn xuất hiện trong những quy trình, chủ trương yêu cầu sự có mặt và có sự thống nhất của “đại diện nhân dân”, như quá trình hiệp thương để lựa chọn ứng viên bầu cử đại biểu nhân dân các cấp, hay cao hơn là ghế thành viên trong Hội đồng Bầu cử Quốc gia.. 
Nói về tên gọi thì có rất nhiều biến thể khác nhau của mô hình này.. 
Vào năm 1930, Hội Phản đế Đồng minh, hình thức đầu tiên của Mặt trận Dân tộc Thống nhất Việt Nam, được hình thành với tiêu chí khá tương đồng với mục tiêu của mô hình mặt trận của Quốc tế Cộng sản. Đó là xây dựng một mô hình tập hợp các giai tầng trong xã hội, trong đó các đảng cộng sản vừa là người chủ xướng việc hình thành, vừa là người lãnh đạo, đồng thời là thành viên tích cực của tổ chức.. 
Tuy nhiên, phải đến năm 1936 thì tên gọi “mặt trận” mới chính thức xuất hiện, đi theo chủ trương chung của Quốc tế Cộng sản. Tổ chức đầu tiên mang tên Mặt trận Thống nhất Nhân dân Phản đế (Mặt trận Phản đế).. 
Do Đảng Cộng sản Đông Dương thành lập và kêu gọi, Mặt trận Phản đế trở thành tổ chức bình phong cũng như mang lại tiếng nói đại diện chung cho đảng này trong các hoạt động đối ngoại. Một ví dụ là việc dùng danh nghĩa của Mặt trận Phản đế để viết thư cho chính phủ Pháp và kêu gọi “tất cả các đảng phái chính trị, tất cả các tầng lớp nhân dân Đông Dương tham gia Mặt trận Nhân dân Đông Dương”.. 
Sau đó, tùy theo tình hình quốc tế, những biến thể của mặt trận nhanh chóng xuất hiện để tranh thủ sự ủng hộ.. 
Khi Mặt trận Bình dân Pháp thành công trong việc nắm quyền kiểm soát chính phủ Pháp, các tổ chức như Thanh niên Dân chủ Đông Dương, Hội Cứu tế bình dân, Công hội, Nông hội, Hội Ái hữu… vốn được các nhân tố cộng sản hình thành, giờ đây hợp nhau lại để cho ra đời Mặt trận Dân chủ Đông Dương.. 
Đến năm 1941, ngay thời điểm Liên Xô bị buộc phải tham chiến vào Chiến tranh Thế giới thứ Hai, mô hình mặt trận phát huy tác dụng mạnh mẽ và hiệu quả qua Việt Nam Độc lập Đồng minh Hội, cũng hay thường được gọi là Mặt trận Việt Minh.. 
Với mô hình này, Đảng Cộng sản Đông Dương nhanh chóng lui vào sau rèm nhiếp chính, bỏ qua yếu tố “cộng sản” trong cương lĩnh chính trị. Họ thu hút được sự ủng hộ không nhỏ của đồng bào yêu nước, từ công nhân, nông dân, trí thức, tiểu tư sản đến tư sản dân tộc, phú nông và địa chủ có tinh thần yêu nước.. 
Từ “đồng minh” được thêm vào khá khéo, biến Mặt trận Việt Minh trở thành một tổ chức được Hoa Kỳ chú ý và hỗ trợ nhiệt tình trong giai đoạn đầu.. 
Riêng trong chiến tranh Việt Nam, chính quyền Bắc Việt kiểm soát và chi viện cho ba hình thức tổ chức mặt trận khác nhau.. 
Thứ nhất là Mặt trận Tổ quốc (cùng tên gọi với mặt trận hiện nay), được thành lập vào năm 1955 tại miền Bắc Việt Nam, với mục tiêu đoàn kết mọi lực lượng dân tộc và dân chủ, đấu tranh đánh bại “đế quốc Mỹ xâm lược và tay sai”.. 
Tiếp theo chắc chắn không thể không nhắc đến Mặt trận Dân tộc Giải phóng Miền Nam Việt Nam (National Liberation Front of Southern Vietnam, thường gọi tắt là NLF, hay tổ chức Việt Cộng theo cách gọi của chính quyền Sài Gòn và quân đội Hoa Kỳ).. 
Thành lập vào năm 1960 và có liên hệ tổ chức với chính quyền Bắc Việt ngay từ trong trứng nước, NLF là tổ chức mặt trận độc lập duy nhất có chính quyền riêng, có quân đội riêng cũng như có ghế riêng trong quá trình thương thảo Hiệp định Paris.. 
NLF được chính quyền hiện nay ca ngợi là thành quả của cao trào đồng khởi của đồng bào miền Nam, là ý nguyện của người dân miền Nam trong việc đánh đuổi giặc Mỹ và ngụy quyền Sài Gòn.. 
Đến năm 1968, ngay sau khi cuộc tổng tiến công Mậu Thân thất bại với thương vong quá lớn, chính quyền Bắc Việt và NLF lại nhận thấy một chiến thắng tâm lý quan trọng đối với dân chúng Hoa Kỳ cũng như dư luận thế giới. Một là người dân thế giới biết thêm về sự tàn khốc của chiến tranh Việt Nam; trong khi chính quyền Johnson gần như bất lực trong việc thuyết phục dư luận cũng như Quốc hội Hoa Kỳ rằng chiến thắng và hòa bình tại miền Nam Việt Nam đã được bảo đảm, điều mà ông này luôn khẳng định trước đó.. 
Trên căn cứ đó, chính quyền Bắc Việt tiếp tục thành lập Liên minh các Lực lượng Dân tộc Dân chủ và Hòa bình Việt Nam (thành lập ngay ngày 20/4/1968, tức là lúc chiến dịch Mậu Thân tại một số nơi vẫn chưa hạ màn).. 
Tận dụng phong trào phản chiến ở Mỹ cũng như vai trò của nhiều nhân sĩ trí thức, lãnh tụ tôn giáo tại miền Nam Việt Nam, Liên minh thành công trong việc đổi chiều các thảo luận về chiến tranh Việt Nam, ảnh hưởng cơ bản lên cách nhìn của thế giới về cuộc chiến này.. 
Như vậy, cho đến khi kết thúc chiến tranh Việt Nam, chính quyền Việt Nam Dân chủ Cộng hòa một tay điều phối ba tổ chức mặt trận còn tồn tại trên dải đất hình chữ S, gồm Mặt trận Tổ quốc Việt Nam, Liên minh các Lực lượng Dân tộc Dân chủ và Hòa Bình tại miền Bắc, và Mặt trận Dân tộc Giải phóng tại miền Nam Việt Nam.. 
Năm 1977, cả ba tổ chức mặt trận thống nhất họp tại Đại hội Mặt trận Dân tộc Thống nhất ở Sài Gòn (lúc này đã đổi tên thành thành phố Hồ Chí Minh). Họ hợp nhất lại chung dưới tên gọi Mặt trận Tổ quốc Việt Nam. Nhánh chính quyền và lực lượng vũ trang của NLF cũng từ đó giải thể và sáp nhập vào bộ máy của Cộng hoà xã hội chủ nghĩa Việt Nam.. 
"
1,"Vị trí chủ tịch nước: Đầu tàu mà không phải đầu tàu
Vị trí chủ tịch nước: Đầu tàu mà không phải đầu tàu
Trong nhiệm kỳ thủ tướng duy nhất của mình, ông Nguyễn Xuân Phúc nổi tiếng với việc biến rất nhiều tỉnh, thành phố thành… “đầu tàu”. Khi thì “đầu tàu kinh tế”, lúc thì “đầu tàu phát triển”. Nay, chính ông trở thành đầu tàu khi nhận lãnh chức chủ tịch nước – vị trí mà về pháp lý là nguyên thủ quốc gia.. 
Nhưng cũng giống như rất nhiều đầu tàu mà ông đã gắn nhãn mác mấy năm qua, vị trí đầu tàu của ông thực ra không phải là đầu tàu. Ông sẽ ngồi làm việc ở tòa dinh thự Pháp cổ có tuổi đời hơn một trăm năm ở số 2 Hùng Vương, Hà Nội, nơi các vị toàn quyền Pháp và vị chủ tịch Hồ Chí Minh từng ngồi, nhưng sẽ không có bao nhiêu quyền lực.. 
Chủ tịch nước xưa nay thường nằm trong Bộ Chính trị của Đảng Cộng sản Việt Nam. Thường thôi, không phải lúc nào cũng vậy. Trường hợp cá biệt là Tôn Đức Thắng, người kế nhiệm Hồ Chí Minh từ năm 1969 đến năm 1981. Ông chỉ là ủy viên trung ương đảng.. 
Vị chủ tịch nước quyền lực nhất trong lịch sử chắc hẳn là Hồ Chí Minh, người nắm chức vụ này từ năm 1946 đến tận khi qua đời năm 1969, nghĩa là hơn 23 năm. Nhưng trong thời kỳ quyền lực nhất của mình, Hồ Chí Minh cũng nắm vị trí lãnh đạo cao nhất của Đảng Cộng sản, lại kiêm cả vị trí thủ tướng tới năm 1955. Từ 1955 đến 1960, ông thôi chức thủ tướng, nhưng nắm hai vị trí chủ tịch đảng lẫn tổng bí thư. Từ 1960 trở đi thì ông chỉ còn là chủ tịch đảng, chủ tịch nước, và với việc Lê Duẩn nổi lên và khuynh loát quyền lực, Hồ Chí Minh không còn là trung tâm của đời sống chính trị nữa. Kể từ đây, chủ tịch nước dần trở thành một vị trí nặng tính lễ nghi.. 
Tôn Đức Thắng, với việc không được bầu vào Bộ Chính trị, dĩ nhiên nắm chức chủ tịch nước mà không có ảnh hưởng gì nhiều. Người kế nhiệm ông, Võ Chí Công, mới lại là ủy viên Bộ Chính trị. Nhưng khi đó, người ta không gọi là chủ tịch nước, mà là chủ tịch Hội đồng Nhà nước, một thiết chế nguyên thủ tập thể, tương tự cơ chế lãnh đạo tập thể của Hội đồng Bộ trưởng, vốn là sản phẩm vay mượn từ Liên Xô và Đông Âu rồi bê nguyên vào Hiến pháp 1980.. 
Có lẽ người sau đó, Lê Đức Anh (1992-1997), mới thực sự xác lập được vị thế đáng kể hơn cho vị trí chủ tịch nước, khi vị trí này trở lại là một chức vụ lãnh đạo cá nhân, thay vì tập thể. Với ảnh hưởng lớn từ thời còn là bộ trưởng quốc phòng, ông Lê Đức Anh đã cùng với Tổng bí thư Đỗ Mười và Thủ tướng Võ Văn Kiệt hình thành nên cái mà nhà báo Huy Đức gọi là “tam nhân phân quyền”. Thế “tứ trụ” lúc này chưa hình thành rõ rệt, mà phải đợi tới cuộc chuyển giao quyền lực năm 1997 mới thực sự được xác lập.. 
Nhưng gọi “tứ trụ” là chỉ trật tự quyền lực trong đảng là chính, còn vị trí chủ tịch nước, trong một chính thể đại nghị như Việt Nam, lại chỉ mang tính lễ nghi, hình thức chứ không có mấy thực quyền.. 
Thể chế đại nghị có đặc trưng là người đứng đầu nhà nước (nguyên thủ) không phải là người đứng đầu nội các. Điển hình là ở hầu hết các nước châu Âu, người đứng đầu nội các là thủ tướng, cũng đồng thời là lãnh đạo phe đa số trong nghị viện; còn người đứng đầu nhà nước là tổng thống hoặc vua, nữ hoàng. Ta thấy ở Đức, Bỉ, Đan Mạch, Anh đều có thủ tướng là nhà lãnh đạo chính trị trung tâm, chứ không phải tổng thống hay vua, nữ hoàng.. 
Việt Nam cũng tương tự. Chủ tịch nước là nguyên thủ quốc gia, theo Hiến pháp là “người đứng đầu Nhà nước, thay mặt nước Cộng hòa xã hội chủ nghĩa Việt Nam về đối nội và đối ngoại”. Tuy vậy, người đứng đầu bộ máy hành chính quốc gia lại là thủ tướng, người có thực quyền rất rộng lớn như tôi đã phân tích ở bài “Thủ tướng chính phủ quyền lực như thế nào?”.. 
Hiến pháp trao cho chủ tịch nước một nhóm quyền hạn nghe thì có vẻ không đến nỗi ít ỏi, nhưng thực tế thì quả là ít ỏi. Các quyền đó bao gồm công bố Hiến pháp, luật, pháp lệnh; có một ít quyền khá giống với quyền phủ quyết đối với pháp lệnh; có khá nhiều quyền liên quan đến việc đề nghị Quốc hội bầu, miễn nhiệm, bãi nhiệm các chức danh cao nhất trong chính quyền; và, trên hết, đó là quyền thống lĩnh các lực lượng vũ trang.. 
Nghe thống lĩnh các lực lượng vũ trang thì quả là to tát, vì có súng trong tay. Nhưng các lực lượng vũ trang Việt Nam chưa bao giờ nằm trong tay chủ tịch nước, nó nằm ở Bộ Chính trị và Quân ủy Trung ương. Bí thư Quân ủy Trung ương thời gian gần đây bao giờ cũng là tổng bí thư, phó bí thư là bộ trưởng quốc phòng. Chủ tịch nước chỉ là ủy viên thường vụ. Duy chỉ có tổng bí thư kiêm chủ tịch nước Nguyễn Phú Trọng là làm tới bí thư Quân ủy Trung ương.. 
Bởi vậy nên chủ tịch nước không có súng. Tiền cũng không, vì quyền hành với ngân sách quốc gia lại nằm ở thủ tướng. Quyền hành của chủ tịch nước, do vậy, nằm chủ yếu ở việc ký các quyết định thăng cấp trong quân đội, quyết định khen thưởng, quyết định liên quan đến quốc tịch, quyết định liên quan đến đặc xá, các quyết định liên quan đến lễ tân ngoại giao, v.v.. 
Quyền hạn vốn đã ít ỏi, các chủ tịch nước Việt Nam từ sau Hồ Chí Minh lại chưa bao giờ thực thi hết quyền hạn của mình trong những vấn đề gai góc, chẳng hạn như quyền cách chức một số vị trí cấp cao trong chính quyền và quân đội, hay quyền phủ quyết với pháp lệnh của Ủy ban Thường vụ Quốc hội.. 
Dù đã chuyển từ chế độ nguyên thủ tập thể (Hội đồng Nhà nước) sang chế độ nguyên thủ cá nhân, chủ tịch nước vẫn chỉ là người thay mặt một tập thể để công bố quyết định, chứ không có quyền hạn chủ động rộng rãi như thủ tướng.. 
Có lẽ quyền lực thực sự của vị trí chủ tịch nước lại nằm ở việc người nắm giữ nó có chân trong Bộ Chính trị và Quân ủy Trung ương. Nếu không chen được vào hai cơ quan này thì chủ tịch nước thực sự chỉ là bù nhìn thuần túy. Vậy nên, khi xét đến quyền lực thực sự của một lãnh đạo chính trị Việt Nam, người ta không thể chỉ xét đến quyền lực theo pháp luật, mà quan trọng hơn là phải xét đến quyền lực trong đảng và sức ảnh hưởng cá nhân của người đó.. 
Ông Nguyễn Xuân Phúc đã trao danh hiệu đầu tàu cho rất nhiều tỉnh, thành mà có lẽ chính bản thân lãnh đạo các tỉnh, thành đó cũng chẳng hiểu họ làm đầu tàu ở chỗ nào. Nay thì chính ông lại rơi vào một vị trí mà chính danh ngôn thuận là đầu tàu, nhưng lại cũng chẳng phải là đầu tàu.. 
"
