,blue
23,"Hội đồng Lý luận Trung ương và vai trò của think tank với các tổ chức chính trị
Hội đồng Lý luận Trung ương và vai trò của think tank với các tổ chức chính trị
Tiêu đề bài viết này nghe có thể lố bịch với nhiều người, bởi Hội đồng Lý luận Trung ương từ lâu đã bị một bộ phận của phong trào đối lập gọi là “Hội đồng Lú lẫn Trung ương”. Sau khi một cán bộ cấp cao của cơ quan này bị phát hiện có lối sống xa hoa, cơ quan này càng trở thành trò cười cho công chúng.. 
Đúng, chúng ta có đủ mọi lý do để cười cợt, chê bai, lên án một tổ chức của Đảng Cộng sản Việt Nam dùng tiền thuế của chúng ta cho việc riêng của họ. Nhưng sau tất cả, sự tồn tại của cơ quan này để lại một bài học cực kỳ quan trọng cho phong trào đối lập: tổ chức chính trị nào cũng cần dựa vào các cơ quan nghiên cứu.. 
Cơ quan nghiên cứu, hay còn được gọi bằng cái tên tiếng Anh thời thượng là “think tank”, chính là bản chất của Hội đồng Lý luận Trung ương. Còn trong các doanh nghiệp, bộ phận tương ứng là các phòng “R&D” (nghiên cứu – phát triển).. 
Ta chớ vội phán xét chất lượng nghiên cứu, thậm chí là mức độ nghiêm túc của các nghiên cứu của Hội đồng Lý luận Trung ương. Ở đây, tôi chỉ muốn nói tới vai trò của think tank đối với một tổ chức chính trị.. 
Ta hãy xem Hội đồng Lý luận Trung ương nghiên cứu những gì, hay nói cho chính xác là tổ chức nghiên cứu những gì, bởi phần việc chính của họ là huy động các nhà nghiên cứu từ các trường, viện tham gia các đề tài.. 
Lướt qua website của hội đồng này, ta thấy hiện nay họ có một “Chương trình nghiên cứu lý luận chính trị” có mã số KX.04/16-20. Chương trình này được thực hiện từ năm 2016 đến năm 2020, gồm 33 đề tài.. 
Trong số các đề tài, ta có thể thấy họ tổ chức nghiên cứu về đủ các lĩnh vực để có cơ sở tư vấn cho Ban chấp hành Trung ương đảng, Bộ chính trị, Ban Bí thư. Chẳng hạn: . 
Hình thức hoạt động của hội đồng này là sản xuất các báo cáo nghiên cứu, tổ chức hội thảo khoa học, đi khảo sát thực địa, v.v. Chúng ta khó mà biết được chất lượng nghiên cứu của các đề tài này đến đâu. Nhưng dù thế nào đi nữa, vai trò của nó là làm cơ sở để Đảng Cộng sản Việt Nam đưa ra các quyết định chính sách của mình trong mọi lĩnh vực.. 
Nhìn sang các nước khác, ta cũng sẽ thấy các đảng phái chính trị cũng phải dựa rất nhiều vào các think tank. . 
Trong bài báo nghiên cứu “Who are The Political Parties’ Ideas Factories? On Policy Analysis by Political Party Think Tanks” công bố năm 2017, các học giả Valérie Pattyn , Gilles Pittoors , Steven Van Hecke đã tổng hợp các nghiên cứu khác và phân loại ra ba hình thức quan hệ giữa các đảng phái chính trị và các cơ quan nghiên cứu. . 
Hình thức thứ nhất là các đảng phái dựa vào các think tank hoàn toàn độc lập bên ngoài để đưa ra quyết định chính sách của mình. Hiện tượng này phổ biến ở Mỹ và Canada. Các địa chỉ lừng danh là CSIS, Brookings, RAND, Cato, CFR và một số đơn vị nghiên cứu thuộc các trường đại học.. 
Hình thức thứ hai là các đảng phái lập ra hoặc tài trợ cho các think tank có tư cách pháp nhân riêng rẽ, và do đó, các think tank này hoạt động trong tình trạng nửa độc lập. Các đảng phái ở Đức, Hà Lan và nhiều nước châu Âu khác thường theo xu hướng này.. 
Hình thức thứ ba là các đảng phái lập ra các think tank hoàn toàn nằm trong tổ chức của đảng. Các think tank này, do vậy, hoàn toàn phụ thuộc vào đảng của họ. Đây chính là mô hình mà Đảng Cộng sản Việt Nam đang áp dụng với Hội đồng Lý luận Trung ương. Brazil cũng theo xu hướng này, mặc dù các đảng phái ở đây cũng dựa rất nhiều vào các tổ chức nghiên cứu tư nhân. . 
Riêng Nhật Bản được các nhà nghiên cứu điểm danh ở cả ba hình thức kể trên. . 
Gần gũi và có thể đáng tham khảo cho Việt Nam hơn là một think tank nghiên cứu chính sách của đảng cầm quyền Dân Tiến của Tổng thống Thái Anh Văn (Tsai Ing-wen) ở Đài Loan. Think tank này trực thuộc tổ chức đảng và theo bà Thái, đảng này đã đưa ra nhiều chính sách dựa trên khuyến nghị của đơn vị nghiên cứu này. Think tank này do chính bà Thái, người từng là giáo sư luật, lập ra năm 2011 khi đang là chủ tịch đảng. . 
Vai trò của các think tank cũng đa dạng. Nhóm nghiên cứu kể trên phân ra làm bốn nhóm vai trò: (i) người gác đền ý thức hệ cho đảng, (ii) chuyên gia chính sách, (iii) cố vấn chính trị, và (iv) trợ lý chính sách. Hai nhóm đầu thường nghiên cứu và đề xuất các ý kiến mang tính dài hạn (chẳng hạn như đề xuất khung chính sách), hai nhóm sau thường đưa ra các ý kiến tư vấn ngắn hạn, phục vụ những nhu cầu tức thời (chẳng hạn như chuẩn bị sẵn luận điểm tranh luận với đảng đối thủ).. 
Nói ra tất cả những điều này, tôi muốn đề cập đến một vấn đề lớn của phong trào đối lập Việt Nam, đó là thiếu các cơ quan nghiên cứu.. 
Trong môi trường chính trị cạnh tranh khốc liệt như ở các nền dân chủ, các đảng phải dựa vào các think tank để có thể phản biện đối thủ và tranh giành ảnh hưởng trong công chúng. Với phong trào đối lập Việt Nam, môi trường chính trị dĩ nhiên là khác biệt rất nhiều, nhưng công việc chính vẫn là phản biện, hoặc thậm chí là phủ nhận các chính sách của Đảng Cộng sản Việt Nam, đồng thời đề xuất những chính sách, giải pháp thay thế.. 
Tuy vậy, phong trào đối lập hiện nay gần như không có hoạt động nghiên cứu nào, càng không có think tank nào, dẫn đến chất lượng phản biện và đề xuất chính sách còn nhiều vấn đề về chất lượng, rất nhiều khi sa vào tin giả và để cho cảm xúc chính trị chi phối môi trường thảo luận.. 
Những vấn đề cần nghiên cứu thì nhiều. Đó không chỉ là các vấn đề chính sách kinh tế – xã hội cụ thể, mà còn là việc nghiên cứu văn hóa chính trị Việt Nam, khảo sát nhu cầu của các bộ phận công chúng, xây dựng các phương án dân chủ hóa, xây dựng các mô hình thể chế, xây dựng các đề xuất hiến pháp, đề xuất các phương án cải cách hiến pháp, soạn thảo các đạo luật cơ bản, v.v.. 
Những nghiên cứu này là cơ sở để xây dựng nghị trình của các tổ chức chính trị trong tương lai, cũng như phác họa dần bức tranh tương lai mà các tổ chức muốn người dân tin vào. . 
Suy cho cùng, muốn có một phong trào đối lập có chất lượng thì công việc đề xuất giải pháp cũng quan trọng ít nhất là không kém công việc phê phán. Không những các tổ chức chính trị, mà các tổ chức xã hội dân sự, thậm chí các tờ báo độc lập (như Luật Khoa) cũng cần có hoạt động nghiên cứu của mình.. 
Hiện nay, ít nhiều cũng đã có một vài nỗ lực nghiên cứu nhất định từ cả phong trào đối lập lẫn các cơ sở nghiên cứu hàn lâm. Tôi có thể điểm danh ít nhất ba bản đề xuất hiến pháp được các nhóm đối lập đưa ra, gồm bản của Đảng Dân chủ Việt Nam (2010), bản của nhóm Kiến nghị 72 (2013), và bản của Trung tâm Dân chủ Việt Nam (2019). Một số nhà hoạt động cũng có những nỗ lực nghiên cứu cá nhân và đề xuất chính sách rất đáng chú ý.. 
Ngoài ra, Đại học California cũng có một tạp chí Việt Nam học (Journal of Vietnamese Studies) đăng nhiều nghiên cứu khoa học xã hội về Việt Nam của các học giả Việt Nam và nước ngoài, và còn nhiều nhà nghiên cứu, nhóm nghiên cứu khác ở các viện, trường cả trong lẫn ngoài nước. Đây là những cơ sở nghiên cứu hàn lâm mà các tổ chức chính trị đối lập có thể dựa vào khi chưa có cơ quan nghiên cứu riêng của mình.. 
Dĩ nhiên, tôi hoàn toàn ý thức được về những khó khăn mà các nhóm đối lập, các tổ chức dân sự, các tờ báo độc lập lẫn các nhà nghiên cứu gặp phải. Đó không chỉ là tài chính, nhân sự mà còn là vấn đề an toàn cá nhân. Tuy vậy, vai trò của các hoạt động nghiên cứu vẫn không thay đổi và là con đường chắc chắn phải đi.. 
Nếu muốn lập một think tank, bạn có thể tham khảo một hướng dẫn chung tại đây.. 
"
24,"Áp đặt “tinh hoa” của đảng hay bầu đại diện của dân?
Áp đặt “tinh hoa” của đảng hay bầu đại diện của dân?
Đảng Cộng sản Việt Nam, bằng Quy định 214, đang nói với dân chúng rằng dân chúng không đủ “sáng suốt” để bầu ra người lãnh đạo đất nước và hãy chấp nhận những “tinh hoa chính trị” mà đảng cử ra.. 
Ngày 02/02/2002, Bộ Chính trị của Đảng Cộng sản Việt Nam chính thức công bố Quy định 214 về Khung tiêu chuẩn chức danh cán bộ thuộc diện Ban Chấp hành Trung ương, Bộ Chính trị, Ban Bí thư quản lý (“Quy định 214”). Theo đó, Bộ Chính trị sửa đổi, đồng thời  bổ sung những quy định cụ thể về phẩm chất và năng lực cần có của các chức danh quan trọng trong nội bộ đảng. . 
Hiểu đơn giản, Quy định 214 giống như một bảng mô tả công việc và yêu cầu vị trí mà chúng ta thường thấy được đăng tải trong các thông tin tuyển dụng. Như đối với Ủy viên của Ban Chấp hành Trung ương Đảng, Quy định 214 yêu cầu “cần phải là người tiêu biểu về bản lĩnh chính trị, phẩm chất đạo đức và năng lực công tác; có năng lực tổ chức thực hiện thắng lợi đường lối, chính sách, nhiệm vụ của Đảng”. Còn nếu là thành viên của Bộ Chính trị và Ban Bí thư thì phải là “ủy viên chính thức Ban Chấp hành Trung ương trọn một nhiệm kỳ trở lên; đã kinh qua và hoàn thành tốt nhiệm vụ ở các chức vụ lãnh đạo chủ chốt cấp tỉnh”. . 
Song sẽ không có gì đáng nói nếu Quy định 214 không đưa ra những tiêu chuẩn cụ thể đối với các chức danh như Chủ tịch nước, Thủ tướng Chính phủ và Chủ tịch Quốc hội, vốn là những vị trí nhà nước, về mặt lý thuyết không phải là các vị trí mang tính đảng, và vì vậy nằm ngoài tầm ảnh hưởng của nội bộ đảng. Theo đó, vị trí Chủ tịch nước được quy định phải là người có “uy tín cao”, là “trung tâm đoàn kết”, có tài năng “nổi trội, toàn diện”; còn Thủ tướng Chính phủ, thì phải “nổi trội toàn diện … trong hoạch định chiến lược phát triển kinh tế – xã hội, quốc phòng, an ninh; tư duy nhạy bén, năng động, quyết đoán…”.v.v. Tất thảy đều là những lời có cánh cho một kiếp người. . 
Hiển nhiên, có thể hiểu rằng Đảng Cộng sản Việt Nam đang tự đề ra những tiêu chuẩn để các thành viên của mình xem xét để có cơ sở mà ứng cử, giới thiệu và bình bầu, lựa chọn người “xứng đáng” cho kỳ bầu cử Quốc hội và Hội đồng Nhân dân các cấp vào năm 2021 tới đây. Tuy vậy, với cơ chế bầu cử ở nước ta, hoàn toàn có thể hiểu Quy định 214 của đảng sẽ quyết định các chức danh lãnh đạo trong nhà nước Việt Nam, nhưng lại được một nhóm vỏn vẹn 17 người trong Bộ Chính trị nghị sự và tự quyết với nhau. . 
Vậy những quy định đẹp đẽ ở trên có đủ để thay thế bởi phiếu bầu phổ thông và công khai từ phía người dân? Hay chúng ta có thể cho rằng giới bình dân Việt Nam quá kém hiểu biết nên phải trao thẩm quyền cho một tầng lớp tinh hoa (như Đảng Cộng sản) lựa chọn người lãnh đạo?. 
Tồn tại một lập luận và phép biện minh cho cơ chế bầu chọn lãnh đạo của Đảng Cộng sản rằng dân chúng Việt Nam có dân trí thấp, dễ bị kích động, không phù hợp để tiến hành bầu cử dân chủ. Vậy nên tốt hơn cả là để cho một thiểu số tinh hoa chọn ra người lãnh đạo, và thiểu số tinh hoa đó hiện nay đang được cho là Đảng Cộng sản Việt Nam.. 
Cũng không phải chỉ ở nước ta mới có kiểu lập luận như vậy. Các học thuyết về kỹ trị (technocracy – hệ thống cho rằng chỉ có các chuyên gia mới có đủ thẩm quyền lãnh đạo và kiến thức để đưa ra các quyết định chính sách) và tri dân chủ (epistocracy – một hệ thống cho rằng chỉ những công dân có “phẩm chất” mới có đủ thông tin và thẩm quyền chính trị để tham gia ứng cử và bầu cử) thật ra không phải là những phát kiến mới mẻ. . 
Triết gia lừng danh thế kỷ 19 John Stuart Mill từng ủng hộ một hệ thống bầu cử dựa trên giai tầng và công việc chuyên môn của cử tri. Cử tri là chuyên gia và những ngành nghề đòi hỏi kiến thức, kỹ năng phức tạp sẽ có sáu phiếu bầu, nông dân và thương gia có ba hoặc bốn phiếu, lao động có tay nghề nắm hai phiếu và lao động phổ thông nắm một phiếu. . 
Hay gần đây, Jason Brennan với tác phẩm Against Democracy cũng khuyến khích một môi trường chính trị nơi mà chỉ có những công dân có phẩm chất, có kiến thức mới nên được phép bầu cử hay ứng cử. Ông viết rằng hầu hết các câu hỏi chính trị trong đời sống đương đại hiện nay đã trở nên quá phức tạp để cho các cử tri thông thường có thể hiểu, họ quá ưa thích những câu trả lời đơn giản cho những câu hỏi phức tạp. Tệ hơn nữa, không chỉ họ không biết, mà thậm chí các cử tri này nghĩ rằng mình biết rõ và biết đúng. Điều này khiến cho hầu hết các quyết định chính trị của cử tri vừa thiếu hiểu biết, vừa ngờ nghệch. Brennan không đề xuất mô hình phiếu bầu dựa trên bằng cấp và trình độ như Mill, mà đề xuất một bài kiểm tra năng lực chính trị thực tế của cử tri trước khi cho phép họ bầu cử. . 
Cơ chế bầu cử của Đảng Cộng sản Việt Nam cũng không nằm ngoài quy luật và định hướng của hai học thuyết kỹ trị và tri dân chủ nói trên: . 
Đúng là một sân chơi của những anh tài.. 
Các cuộc bầu cử dân chủ rõ là không làm hài lòng hết tất cả mọi người, nếu không muốn nói là chúng đang khiến nhiều người thất vọng.. 
Tổng thống Mỹ Donald Trump là một ví dụ. . 
Trong quá trình bầu cử nội bộ đảng (primary election) để chọn ra ứng cử viên đại diện cho Đảng Cộng hòa để đối đầu với ứng cử viên từ Đảng Dân chủ hay các đảng phái độc lập khác trong cuộc bầu cử tổng thống chính thức năm 2016, có đến 50 đảng viên kỳ cựu của đảng này viết thư công khai phản đối việc tiếp tục để Donald Trump tham gia hoặc bỏ phiếu cho ông này. . 
Cụ thể, tướng Michael Hayden (tướng bốn sao, nguyên Giám đốc CIA và NSA) cho rằng Trump không có đúng khí chất, tính cách, sự kiên nhẫn, văn minh, kiến thức, hay thậm chí là sự tò mò, ham học hỏi… những tố chất cần có để xứng đáng với chức danh tổng thống. Với ngôn ngữ tương tự, David French, một cây bút quen thuộc của Dispatch và Times, chưa hề giấu giếm rằng mình thuộc phong trào “Chống – Trump”, khẳng định mạnh mẽ rằng tính cách chính là định mệnh của một người. Khí chất, kiến thức và sự chính trực của một người sẽ định hình hành vi của anh ta. Chúng ta có thể hy vọng rằng sức nặng của thể chế dân chủ và vai trò của các cố vấn chuyên môn sẽ định hình và kiểm soát một vị tổng thống có quá nhiều thiếu sót, song những sai lầm vẫn sẽ bùng phát, đặc biệt đối với một kẻ cứng đầu như Trump. . 
Nhưng đến cuối cùng, với chiến thắng trong cuộc bầu cử 2016, ông này vẫn cho thấy mình được một bộ phận không nhỏ cử tri Hoa Kỳ đón nhận, bất kể bao nhiêu lời thị phi rằng mình không “xứng đáng” hay không đủ “phẩm chất”. Không chỉ vậy, giữa tâm bão bị luận tội, tỉ lệ ủng hộ Trump không chỉ ổn định, mà còn tăng mạnh.. 
Người viết sẽ không đi vào quá sâu việc bình luận về Trump, bởi việc đánh giá ông này vẫn còn rất nhiều tranh cãi, kể cả giữa người Việt Nam với nhau. Nhưng có một khả năng hoàn toàn có thể xảy ra: người dân bầu chọn cho những người được xem là không xứng đáng. . 
Một nghiên cứu khá chi tiết của Pew Research về quan điểm của cử tri về chất lượng ứng cử viên cho các vị trí dân cử của Hoa Kỳ cho thấy họ không đánh giá cao phẩm chất và năng lực của những ứng cử viên. Chỉ có 47% cho rằng chất lượng của các ứng cử là tốt, và thậm chí chưa tới 5% đánh giá phẩm chất, năng lực của các ứng cử viên là rất tốt. 52% còn lại đều có cái nhìn tiêu cực. Riêng về vị trí tổng thống, đến 58% khẳng định họ không hài lòng với những lựa chọn ứng cử viên mà họ có. . 
Không chỉ vậy, cũng theo Pew, dân chúng tại 12 quốc gia dân chủ điển hình đại diện cho hầu hết các đại lục đều không hài lòng với cách mà nền dân chủ quốc gia họ đang vận hành. Danh sách này bao gồm cả những quốc gia dân chủ cấp tiến có máu mặt suốt hàng thế kỷ như Hoa Kỳ, Vương quốc Anh hay Nhật Bản. Đồng biến với hàm này, quan điểm của người dân các quốc gia này dành cho những quan chức do chính họ bầu chọn cũng không phải là cao. Nếu tại Hy Lạp, có đến 90% dân số tin rằng những chức danh dân cử không quan tâm gì đến ý chí, quan điểm và nguyện vọng của một người bình dân; cũng hơn 58% dân số Hoa Kỳ chia sẻ ý kiến này. Thậm chí, dù các chỉ số về minh bạch và xử lý tham nhũng tại Hoa Kỳ luôn được đánh giá khả quan bởi các tổ chức độc lập, có đến 69% người tham gia khảo sát đồng tình với quan điểm các chính trị gia nước này đều tham nhũng và suy đồi… . 
Với những con số rõ như ban ngày như vậy, và thực tế rằng ở các quốc gia châu Phi, nơi mà những cuộc bầu cử dân chủ đang bị biến thành cuộc chơi chi tiền và lèo lái một đám đông thiếu thông tin, điều gì còn khiến cho thế giới vẫn duy trì cơ chế bầu cử dựa trên phổ thông đầu phiếu như thế? Tại sao cả thế giới vẫn chưa từ bỏ chúng để tiến đến việc giao quyền chính trị cho một bộ phận tinh hoa, có hiểu biết, có học thức, và quan trọng nhất là có “phẩm chất lãnh đạo”, những người rõ ràng ở vị thế tốt hơn để lãnh đạo và lèo lái đất nước?. 
Sẽ có nhiều điều để bàn về cái hay và cái dở giữa những người “được bầu” và những người có “phẩm chất” lãnh đạo; song ngộ nhận trước tiên của những người phản đối bầu cử phổ thông mà người viết thấy cần chỉ ra, là họ cho rằng đại đa số quần chúng sẽ chọn sai người, nhưng cùng lúc đó tin tưởng một giai tầng “tinh hoa” bé nhỏ lại chọn ra đúng người phục vụ lợi ích đại chúng mà không chịu ảnh hưởng từ các nhóm lợi ích, ưu tiên cá nhân hay các yếu tố “hậu cung” khác. Một niềm tin hoàn toàn vô căn cứ. . 
Vì sao, theo mô hình phân chia giai cấp như của Mill, một luật sư lại nên có số phiếu gấp ba lần số phiếu của một công nhân có tay nghề, trong khi chính trị và các vấn đề an sinh thật ra chỉ là một phần chuyên biệt rất nhỏ trong các chuyên ngành luật, vốn không phải luật sư nào cũng đủ hiểu biết để bàn về nó, chưa nói đến là đúng hay sai? Đến cuối cùng, bản thân Mill cũng nhận thấy ông cần xây dựng một hệ thống phản ánh đầy đủ các quan điểm trong xã hội, và ý tưởng về một nội các chỉ toàn các nhà kinh tế học khiến ông phải hãi hùng.. 
Còn mô hình kiểm tra năng lực cử tri của Jason Brennan, như nhận định của giáo sư chính trị David Runciman của trường Đại học Cambridge, chỉ đang đẩy câu hỏi của mình về điểm bắt đầu và không trả lời thêm được bất kỳ điều gì. Ai sẽ được cho là đủ năng lực để soạn bài kiểm tra? . 
Các giáo sư đại học? Bản thân họ cũng có những lợi ích và quan điểm chính trị riêng.. 
Các nhà kinh tế học? Họ có thể thao thao bất tuyệt về hàng loạt những quy luật thị trường, nhưng ít khi thấy họ đoán đúng điều gì về tương lai của thị trường.. 
Và Brennan, với tư cách là một giảng viên đại học, có lẽ cũng đã từng thấy sinh viên nhồi nhét kiến thức để vượt qua các kỳ thi, thời điểm mà bản thân họ cũng đã hình thành nên những định kiến và điểm mù của riêng mình. . 
Những người ủng hộ mô hình “tri dân chủ” cũng phải đối mặt với sự thật rằng giới có học thức, giới tinh hoa gì đấy thật ra cũng chịu ảnh hưởng của đám đông và thiên kiến nhóm tương tự như mọi thành phần khác trong xã hội, mà đôi khi còn hơn thế. Như hai nhà khoa học Larry Bartels và Christopher Achen từng chỉ ra: Lịch sử cho thấy những nhóm trí thức, dù tinh hoa hay không, đều có thể bị lệch lạc về đạo đức chính trị và tư duy chính trị như bất kỳ ai khác. . 
Người viết nhìn thấy được những khuyết điểm và vấn đề của mô hình dân chủ đại diện và bầu cử hiện đại ngày nay, nhưng điều này không đồng nghĩa với việc nó là một mô hình tồi, xét theo cả hiệu quả cuối cùng lẫn công bình xã hội. Như trong hôn nhân, ai cũng có thể chọn sai bạn đời, tương tự như cách mà chúng ta bầu sai người. Song với thể chế dân chủ, người ta vẫn còn những cơ chế kiểm soát, vẫn có thể bầu lại, giống như cách chúng ta có thể ly dị và cưới lại. Còn khi mà quyền quyết định của người dân bị tước đoạt trong những cuộc hôn nhân “cha mẹ đặt đâu con ngồi đó”, mọi thứ câu từ hoa mỹ sơn son thiếp vàng như “năng lực”, “phẩm chất”, “tinh hoa”, “kỹ trị” hay “tri dân chủ” đều chỉ là những phép biện minh vụng về mà thôi.. 
"
